{
  "meta": {
    "schema": "cumulative",
    "schema_version": "0.1",
    "revision": 2,
    "created_at": "2026-10-03T20:18:23+09:00",
    "updated_at": "2026-10-03T20:18:24+09:00",
    "updated_by": "pipeline"
  },
  "project_id": "P-APC-101",
  "as_of_week": "2026-W39",
  "prev_ref": "data/derived/cumulative/P-APC-101/2026-W38.json",
  "items": [
    {
      "text": "불량률 0.180% → 0.150% 확인",
      "source_ids": [
        "D-260922-tester-01"
      ],
      "kind": "fact",
      "changed": false
    }
  ],
  "pinned_facts": [
    {
      "text": "불량률 0.180% → 0.150% 확인",
      "source_ids": [
        "D-260922-tester-01"
      ],
      "kind": "fact",
      "changed": false
    }
  ],
  "mode": "incremental",
  "ai": {
    "model": "mock",
    "prompt_id": "cumulative_update",
    "prompt_version": "v0.2",
    "generated_at": "2026-10-03T20:18:24+09:00",
    "input_revisions": {
      "P-APC-101": 1,
      "D-260922-tester-01": 1
    }
  }
}
