{
  "meta": {
    "schema": "cumulative",
    "schema_version": "0.1",
    "revision": 1,
    "created_at": "2026-10-03T21:36:40+09:00",
    "updated_at": "2026-10-03T21:36:40+09:00",
    "updated_by": "pipeline"
  },
  "project_id": "P-ROL-102",
  "as_of_week": "2026-W39",
  "prev_ref": "data/derived/cumulative/P-ROL-102/2026-W38.json",
  "items": [
    {
      "text": "WA 적용 일정 9/25 → 9/30 변경",
      "source_ids": [
        "D-260922-tester-02"
      ],
      "kind": "fact",
      "changed": false
    }
  ],
  "pinned_facts": [
    {
      "text": "WA 적용 일정 9/25 → 9/30 변경",
      "source_ids": [
        "D-260922-tester-02"
      ],
      "kind": "fact",
      "changed": false
    }
  ],
  "mode": "incremental",
  "ai": {
    "model": "mock",
    "prompt_id": "cumulative_update",
    "prompt_version": "v0.2",
    "generated_at": "2026-10-03T21:36:40+09:00",
    "input_revisions": {
      "P-ROL-102": 1,
      "D-260922-tester-02": 1
    }
  }
}
