{
  "meta": {
    "schema": "cumulative",
    "schema_version": "0.1",
    "revision": 1,
    "created_at": "2026-09-18T18:10:00+09:00",
    "updated_at": "2026-09-18T18:10:00+09:00",
    "updated_by": "pipeline"
  },
  "project_id": "P-ASM-001",
  "as_of_week": "2026-W38",
  "prev_ref": null,
  "items": [
    {
      "text": "1차 로직(8/13): EPC 미보정·보정량 부족 개선, 이음매 예측 보정 세분화(2→3회)",
      "source_ids": [
        "P-ASM-001"
      ],
      "kind": "fact",
      "changed": false
    },
    {
      "text": "1차 적용 결과 E77 18대 중 12대 감소, 6대 증가(#13-1·2 등)",
      "source_ids": [
        "P-ASM-001"
      ],
      "kind": "fact",
      "changed": false
    },
    {
      "text": "2차 로직(9/4~): 예측 보정 Limit ±0.35mm, 이음매 이후 즉시 Feedback",
      "source_ids": [
        "P-ASM-001"
      ],
      "kind": "fact",
      "changed": false
    },
    {
      "text": "2차 대표 4대 0.270% → 0.185%, 결과 법인 공유(9/15)",
      "source_ids": [
        "P-ASM-001"
      ],
      "kind": "fact",
      "changed": false
    },
    {
      "text": "MEB 전 라인·ESMI1 #2-2·3 수평전개 완료(9/16)",
      "source_ids": [
        "P-ASM-001"
      ],
      "kind": "fact",
      "changed": false
    }
  ],
  "pinned_facts": [
    {
      "text": "1차 적용 E77 위치 불량률 0.189% → 0.164%",
      "source_ids": [
        "P-ASM-001"
      ],
      "kind": "fact",
      "changed": false
    }
  ],
  "mode": "incremental",
  "ai": {
    "model": "EXAONE (사내 API)",
    "prompt_id": "cumulative_update",
    "prompt_version": "v0.1",
    "generated_at": "2026-09-18T18:10:00+09:00",
    "input_revisions": {
      "P-ASM-001": 7
    }
  }
}