{
  "meta": {
    "schema": "cumulative",
    "schema_version": "0.1",
    "revision": 1,
    "created_at": "2026-09-21T09:00:00+09:00",
    "updated_at": "2026-09-21T09:00:00+09:00",
    "updated_by": "tester"
  },
  "project_id": "P-INV-103",
  "as_of_week": "2026-W38",
  "prev_ref": null,
  "items": [],
  "pinned_facts": [],
  "mode": "incremental",
  "ai": {
    "model": "fixture",
    "prompt_id": "cumulative_update",
    "prompt_version": "v0.2",
    "generated_at": "2026-09-21T09:00:00+09:00",
    "input_revisions": {
      "P-INV-103": 1
    }
  }
}
