{
  "meta": {
    "schema": "cumulative",
    "schema_version": "0.1",
    "revision": 1,
    "created_at": "2026-10-04T08:43:03+09:00",
    "updated_at": "2026-10-04T08:43:03+09:00",
    "updated_by": "pipeline"
  },
  "project_id": "P-INV-103",
  "as_of_week": "2026-W39",
  "prev_ref": "data/derived/cumulative/P-INV-103/2026-W38.json",
  "items": [
    {
      "text": "투자 심의 9/22 완료",
      "source_ids": [
        "D-260922-tester-03"
      ],
      "kind": "fact",
      "changed": false
    }
  ],
  "pinned_facts": [
    {
      "text": "투자 심의 9/22 완료",
      "source_ids": [
        "D-260922-tester-03"
      ],
      "kind": "fact",
      "changed": false
    }
  ],
  "mode": "incremental",
  "ai": {
    "model": "mock",
    "prompt_id": "cumulative_update",
    "prompt_version": "v0.2",
    "generated_at": "2026-10-04T08:43:03+09:00",
    "input_revisions": {
      "P-INV-103": 1,
      "D-260922-tester-03": 1
    }
  }
}
