{
  "meta": {
    "schema": "cumulative",
    "schema_version": "0.1",
    "revision": 2,
    "created_at": "2026-10-04T15:56:54+09:00",
    "updated_at": "2026-10-04T15:57:05+09:00",
    "updated_by": "pipeline"
  },
  "project_id": "00000000-0000-4000-8000-000000000001",
  "as_of_week": "2026-W40",
  "prev_ref": null,
  "items": [
    {
      "text": "팀원 5명 인터뷰로 반복 보고 업무 3종을 도출해 요건 분석을 완료했습니다. (10/01)",
      "source_ids": [
        "D-261001-00000011-01"
      ],
      "kind": "fact",
      "changed": false
    },
    {
      "text": "업무기록 웹(FAST API·node js, SQLite)과 json 적재 체계 구축을 시작했습니다. (10/04)",
      "source_ids": [
        "D-261004-00000010-01"
      ],
      "kind": "fact",
      "changed": false
    }
  ],
  "pinned_facts": [
    {
      "text": "반복 보고 업무 3종 도출 (팀원 5명 인터뷰)",
      "source_ids": [
        "D-261001-00000011-01"
      ],
      "kind": "fact",
      "changed": false
    }
  ],
  "mode": "incremental",
  "ai": {
    "model": "mock",
    "prompt_id": "cumulative_update",
    "prompt_version": "v0.6",
    "generated_at": "2026-10-04T15:57:05+09:00",
    "input_revisions": {
      "00000000-0000-4000-8000-000000000001": 3,
      "D-261001-00000011-01": 1,
      "D-261004-00000010-01": 3
    }
  }
}
