{
  "meta": {
    "schema": "cumulative",
    "schema_version": "0.1",
    "revision": 1,
    "created_at": "2026-10-03T21:47:56+09:00",
    "updated_at": "2026-10-03T21:47:56+09:00",
    "updated_by": "pipeline"
  },
  "project_id": "P-APC-101",
  "as_of_week": "2026-W37",
  "prev_ref": null,
  "items": [],
  "pinned_facts": [],
  "mode": "incremental",
  "ai": {
    "model": "AI 호출 없음 (Daily 없음, 이전 누적 유지)",
    "prompt_id": "cumulative_update",
    "prompt_version": "v0.2",
    "generated_at": "2026-10-03T21:47:56+09:00",
    "input_revisions": {
      "P-APC-101": 1
    }
  }
}
